{
  "_meta": { "status": "scaffold", "behavior": "DATA ONLY. No module reads these rules yet. Building the progression engine is OUT OF SCOPE for this PR.", "purpose": "Encodes the deterministic progression decision table so a future ProgressionModule can consume it.", "derived_from": ["01-science-math-architecture", "04-coaching-intelligence-architecture"] },
  "decision_table": [
    { "id": "underloaded", "when": "Hit all planned sets, reached top of rep target, technique acceptable, pain low, effort easier than prescribed", "interpretation": "Underloaded relative to current capability", "default_action": "increase_load", "provenance": { "sources": ["04-coaching-intelligence-architecture"], "evidence_tier": 2, "confidence": "high", "contested": false } },
    { "id": "on_target", "when": "Hit all planned sets with appropriate effort and technique", "interpretation": "On target", "default_action": "maintain_or_add_reps", "provenance": { "sources": ["04-coaching-intelligence-architecture"], "evidence_tier": 2, "confidence": "high", "contested": false } },
    { "id": "normal_variability", "when": "Missed top of range but stayed within minimum reps and tolerance", "interpretation": "Normal session-to-session variability", "default_action": "hold_progression", "provenance": { "sources": ["04-coaching-intelligence-architecture"], "evidence_tier": 4, "confidence": "medium", "contested": false } },
    { "id": "likely_fatigue", "when": "Missed minimum reps on multiple sets, effort much harder than prescribed, or velocity suppressed", "interpretation": "Likely fatigue or over-prescription", "default_action": "hold_or_reduce_load", "provenance": { "sources": ["04-coaching-intelligence-architecture", "01-science-math-architecture"], "evidence_tier": 2, "confidence": "medium", "contested": false } },
    { "id": "injury_signal", "when": "Local joint pain, compensatory technique, or sharp focal pain emerged", "interpretation": "Elevated injury risk", "default_action": "swap_exercise_or_reduce_rom", "provenance": { "sources": ["04-coaching-intelligence-architecture"], "evidence_tier": 1, "confidence": "high", "contested": false } },
    { "id": "candidate_plateau", "when": "Multiple consecutive exposures underperform expected output despite acceptable recovery", "interpretation": "Candidate plateau or stale stimulus", "default_action": "change_variant_reps_or_volume", "provenance": { "sources": ["04-coaching-intelligence-architecture"], "evidence_tier": 2, "confidence": "medium", "contested": false } }
  ],
  "lever_order": { "description": "Cheapest-to-most-expensive progression lever. Increase load before reps before sets; sets are the expensive lever (fatigue + time).", "order": ["load", "reps", "sets"], "provenance": { "sources": ["04-coaching-intelligence-architecture", "02-coaching-knowledge-architecture"], "evidence_tier": 2, "confidence": "high", "contested": false } },
  "increment_defaults": { "description": "Default load jumps when increasing. Heuristic; smallest available increment wins.", "upper_body_pct": [2.5, 5], "lower_body_lb": [5, 10], "note": "ACSM: 2-10% load increase when the trainee can perform 1-2 reps over target.", "provenance": { "sources": ["02-coaching-knowledge-architecture", "01-science-math-architecture"], "evidence_tier": 1, "confidence": "high", "contested": false } },
  "one_bad_session_vs_plateau": { "ignore_single_session_if": "isolated and explainable (poor sleep, stress, missed nutrition) with no red flags", "flag_plateau_if": "no progress across >=3 sessions or 2-3 weeks despite adequate recovery", "provenance": { "sources": ["02-coaching-knowledge-architecture", "04-coaching-intelligence-architecture"], "evidence_tier": 4, "confidence": "medium", "contested": false } }
}
